{
  "$schema": "../icon.schema.json",
  "use-cases": ["源代码目录", "开发项目", "编程工作区"],
  "name": "文件夹代码",
  "tags": ["代码", "编程", "开发", "源代码", "项目文件"],
  "categories": ["files", "development"],
  "i18n": {
    "en": {
      "name": "folder code",
      "tags": ["code", "programming", "development", "source code", "project files"],
      "use-cases": ["Source code directory", "Development projects", "Programming workspace"]
    }
  }
}
