{
  "$schema": "../icon.schema.json",
  "use-cases": [],
  "name": "勾选",
  "tags": [
    "完成",
    "待办事项",
    "勾选",
    "完成",
    "任务"
  ],
  "categories": [
    "notifications"
  ],
  "i18n": {
    "en": {
      "name": "check",
      "tags": [
        "done",
        "todo",
        "tick",
        "complete",
        "task"
      ],
      "use-cases": []
    }
  }
}
