{
  "$schema": "../icon.schema.json",
  "use-cases": ["角色扮演游戏物品栏", "历史文档界面", "奇幻游戏UI元素", "档案系统图标"],
  "name": "滚动",
  "tags": ["卷轴", "滚动", "羊皮卷", "古代文档", "游戏道具", "历史文献"],
  "categories": ["gaming", "development", "text"],
  "i18n": {
    "en": {
      "name": "scroll",
      "tags": ["scroll", "parchment", "ancient document", "game item", "historical manuscript", "roll"],
      "use-cases": ["RPG game inventory item", "Historical document interface", "Fantasy game UI element", "Archive system icon"]
    }
  }
}
