{
  "$schema": "../icon.schema.json",
  "use-cases": [],
  "name": "发送",
  "tags": [
    "邮箱",
    "消息",
    "邮件",
    "纸飞机",
    "纸飞机",
    "提交"
  ],
  "categories": [
    "mail",
    "communication",
    "connectivity"
  ],
  "i18n": {
    "en": {
      "name": "send",
      "tags": [
        "email",
        "message",
        "mail",
        "paper airplane",
        "paper aeroplane",
        "submit"
      ],
      "use-cases": []
    }
  }
}
