{
  "$schema": "../icon.schema.json",
  "use-cases": [],
  "name": "文件加号",
  "tags": [
    "添加",
    "创建",
    "新建",
    "文档"
  ],
  "categories": [
    "files"
  ],
  "i18n": {
    "en": {
      "name": "file plus",
      "tags": [
        "add",
        "create",
        "new",
        "document"
      ],
      "use-cases": []
    }
  }
}
