{
  "$schema": "../icon.schema.json",
  "use-cases": ["显示7点时间", "早晨闹钟或晚间新闻时间", "基于时间的触发器"],
  "name": "时钟7",
  "tags": ["时间", "时钟", "时刻", "7点", "早上", "晚上"],
  "categories": ["time"],
  "i18n": {
    "en": {
      "name": "clock 7",
      "tags": ["time", "clock", "hour", "7", "seven", "o'clock"],
      "use-cases": ["Time display for 7:00", "Morning alarm or evening news time", "Time-based triggers"]
    }
  }
}
