{
  "$schema": "../icon.schema.json",
  "use-cases": ["收藏项目", "评价内容", "书签页面", "高亮重要", "喜欢帖子"],
  "name": "星标",
  "tags": ["星标", "收藏", "喜欢", "评分", "评级", "书签", "重要"],
  "categories": ["account", "social", "shapes", "multimedia", "weather", "emoji", "gaming"],
  "i18n": {
    "en": {
      "name": "star",
      "tags": ["star", "favorite", "like", "rating", "review", "bookmark", "important"],
      "use-cases": ["Favorite item", "Rate content", "Bookmark page", "Highlight important", "Like post"]
    }
  }
}
