{
  "$schema": "../icon.schema.json",
  "use-cases": ["视频播放器控制", "无障碍设置界面", "多媒体应用设置", "字幕开关控制"],
  "name": "字幕关闭",
  "tags": ["关闭字幕", "隐藏字幕", "无障碍功能", "视频设置"],
  "categories": ["multimedia"],
  "i18n": {
    "en": {
      "name": "captions off",
      "tags": ["captions off", "subtitles disabled", "accessibility", "video settings"],
      "use-cases": ["Video player controls", "Accessibility settings interface", "Multimedia app settings", "Caption toggle control"]
    }
  }
}
