{
  "$schema": "../icon.schema.json",
  "use-cases": [],
  "name": "图表列上升",
  "tags": [
    "统计",
    "分析",
    "图表",
    "图",
    "趋势上升"
  ],
  "categories": [
    "charts"
  ],
  "aliases": [
    {
      "name": "bar-chart-4",
      "deprecated": true,
      "deprecationReason": "alias.name",
      "toBeRemovedInVersion": "v1.0"
    }
  ],
  "i18n": {
    "en": {
      "name": "chart column increasing",
      "tags": [
        "statistics",
        "analytics",
        "diagram",
        "graph",
        "trending up"
      ],
      "use-cases": []
    }
  }
}
