{
  "$schema": "../icon.schema.json",
  "use-cases": ["音乐播放器控制", "多媒体手势交互", "表情符号反应"],
  "name": "手金属",
  "tags": ["摇滚", "手势", "音乐", "多媒体", "表情符号", "金属礼"],
  "categories": ["emoji", "multimedia"],
  "i18n": {
    "en": {
      "name": "hand metal",
      "tags": ["rock", "gesture", "music", "multimedia", "emoji"],
      "use-cases": ["Music player controls", "Multimedia gestures", "Emoji reactions"]
    }
  }
}
