{
  "$schema": "../icon.schema.json",
  "use-cases": [],
  "name": "文件扫描",
  "tags": [
    "扫描",
    "代码",
    "二维码"
  ],
  "categories": [
    "files"
  ],
  "i18n": {
    "en": {
      "name": "file scan",
      "tags": [
        "scan",
        "code",
        "qr-code"
      ],
      "use-cases": []
    }
  }
}
