{
  "$schema": "../icon.schema.json",
  "use-cases": [],
  "name": "烧瓶圆锥关闭",
  "tags": [
    "烧杯",
    "埃伦迈耶",
    "无毒",
    "实验室",
    "化学",
    "实验",
    "测试"
  ],
  "categories": [
    "science",
    "gaming"
  ],
  "i18n": {
    "en": {
      "name": "flask conical off",
      "tags": [
        "beaker",
        "erlenmeyer",
        "non toxic",
        "lab",
        "chemistry",
        "experiment",
        "test"
      ],
      "use-cases": []
    }
  }
}
