{
  "$schema": "../icon.schema.json",
  "use-cases": [],
  "name": "线缆汽车",
  "tags": [
    "滑雪缆车",
    "寒假",
    "高山",
    "度假村",
    "山"
  ],
  "categories": [
    "transportation",
    "travel"
  ],
  "i18n": {
    "en": {
      "name": "cable car",
      "tags": [
        "ski lift",
        "winter holiday",
        "alpine",
        "resort",
        "mountains"
      ],
      "use-cases": []
    }
  }
}
