{
  "$schema": "../icon.schema.json",
  "use-cases": [],
  "name": "时钟十二",
  "tags": [
    "时间",
    "手表",
    "闹钟",
    "中午",
    "午夜"
  ],
  "categories": [
    "time"
  ],
  "i18n": {
    "en": {
      "name": "clock 12",
      "tags": [
        "time",
        "watch",
        "alarm",
        "noon",
        "midnight"
      ],
      "use-cases": []
    }
  }
}
