{
  "$schema": "../icon.schema.json",
  "use-cases": [],
  "name": "显示器智能手机",
  "tags": [
    "智能手机",
    "电话",
    "手机",
    "装置",
    "移动",
    "桌面",
    "显示器",
    "反应灵敏",
    "屏幕"
  ],
  "categories": [
    "connectivity",
    "devices"
  ],
  "i18n": {
    "en": {
      "name": "monitor smartphone",
      "tags": [
        "smartphone",
        "phone",
        "cellphone",
        "device",
        "mobile",
        "desktop",
        "monitor",
        "responsive",
        "screens"
      ],
      "use-cases": []
    }
  }
}
